{
  "workspace_revision_id": "wsr_01J00000000000000000000000",
  "tenant_id": "ten_01J00000000000000000000000",
  "workspace_id": "wsp_01J00000000000000000000000",
  "branch_id": "main",
  "revision_number": 1,
  "parent_revision_id": null,
  "content_manifest_artifact": {
    "artifact_id": "art_workspace_manifest_01J000000000000000",
    "version_id": "ver_workspace_manifest_01J00000000000000",
    "name": "workspace-manifest.json",
    "media_type": "application/vnd.agent.workspace-manifest+json",
    "role": "source",
    "digest": "sha256:8dfcb5bb6d9d98edc1bf5b8f6a24beb60267e13635bf31190eac7a1c8a612098",
    "size_bytes": 601
  },
  "content_manifest_schema_id": "urn:agent-platform:workspace-content-manifest:v1",
  "produced_by_work_order_id": "wrk_01J00000000000000000000000",
  "revision_digest": "sha256:366b5c58b91f28f19b73b1287cc13488b6055b5a7d57bbd21f065e3340b5bde1",
  "created_at": "2026-07-15T10:00:00Z"
}
